{
  "artifact_manifest_sha256": "e45fb89ef389f37dd969cc168b919468dad46e2d1cce9d974a62ac9c9b6026ce",
  "artifacts": [
    {
      "access": "public",
      "bytes": 275842,
      "id": "artifact-01",
      "media_type": "image/png",
      "repository_path": "paper/overleaf_jnm/figures/final/fig14_expanded_automated_validation.png",
      "role": "figure",
      "sha256": "a925c36595a99dd68e1ee9094a2e489e966a71273de1c05fd1d61b44d2bb2af6"
    },
    {
      "access": "public",
      "bytes": 3085,
      "id": "artifact-02",
      "media_type": "application/json",
      "repository_path": "paper/overleaf_jnm/generated_analysis/expanded_automated_validation_v3/summary.json",
      "role": "summary",
      "sha256": "ec30ccfd9fb3f86f4a32af665be2514af02d3a7aa732b5fa2eae037f96fd1b49"
    },
    {
      "access": "public",
      "bytes": 2715,
      "id": "artifact-03",
      "media_type": "text/markdown",
      "repository_path": "docs/research/SPON_CA_BURST_EXPANDED_AUTOMATED_VALIDATION_V3_RESULTS.md",
      "role": "report",
      "sha256": "58bbbe5bfca24eb34a0a38c330dcddfff9cf230e39e986417ff06b5e6a9ed71f"
    }
  ],
  "boundaries": {
    "does_not_establish": [
      "Claims beyond the registered finding and linked claim scopes.",
      "Reproducible run provenance that was absent from the v1 story."
    ],
    "limitations": [
      "Same recording, 12 misses, reused exploratory labels, one-dimensional mixtures, and only one identity-clear cross-burst pair."
    ],
    "scope": "This capsule preserves the registered v1 experiment finding and its linked claim scopes."
  },
  "claim_impacts": [
    {
      "claim_id": "NREV-CLM-0007",
      "effect": "supports",
      "scope": "106 occurrences at 50 sites in one recording; 12 misses; 100 site-bootstrap sparse fits; synthetic tests are one-dimensional and cross-burst transfer has only one identity-clear pair.",
      "summary": "The experiment supports this claim only within its registered scope."
    }
  ],
  "evidence_tier": "current_recording",
  "experiment_id": "NREV-EXP-0008",
  "gates": [
    {
      "criterion": "Every artifact referenced by the v1 experiment story is available and checksum identified at migration.",
      "id": "legacy-artifact-capture",
      "observed": "Captured 3 of 3 referenced artifacts with SHA-256 identities.",
      "status": "passed"
    }
  ],
  "generated_at": "2026-08-29T23:52:35Z",
  "id": "NREV-EVC-EXP-0008",
  "legacy_status": "complete_exploratory",
  "lifecycle": "validated",
  "metrics": [],
  "outcome": "inconclusive",
  "program_id": "NREV-PRG-0001",
  "record_type": "evidence_capsule",
  "review_state": "not_requested",
  "run_ids": [],
  "schema_version": 1,
  "source_records_sha256": "d8234f9a025f6ea768f1c7e0b855fbf229223117b7876a2c978a389009ae9876",
  "summary": "The full panel exceeded carrier-only grouped prediction; annular context, persistence, and lag were most stable, abstention reduced internal error, anomaly scores prioritized misses, and distance-only graph crowding added little.",
  "validation": {
    "checked_at": "2026-08-29T23:52:35Z",
    "checks": [
      {
        "id": "portable-paths",
        "status": "passed",
        "summary": "Artifact references are repository-relative; ignored local outputs are metadata-only."
      },
      {
        "id": "historical-provenance",
        "status": "not_run",
        "summary": "The v1 story did not encode run-level provenance, so no historical run record was invented."
      }
    ],
    "status": "partial"
  },
  "visibility": "public"
}
