{
  "artifact_manifest_sha256": "217507c19ea3c8d733e9cd14484dc0cbb26cdbdab5a2485b8921ef9340aae68b",
  "artifacts": [
    {
      "access": "public",
      "bytes": 5683,
      "id": "artifact-01",
      "media_type": "application/json",
      "repository_path": "paper/overleaf_jnm/figures/final/fig04_trace_taxonomy_experiment.json",
      "role": "report",
      "sha256": "df03ec768d58385d8b678f69845b9c7a5690ab7761cbde67d5ed48a10e075417"
    },
    {
      "access": "public",
      "bytes": 3026,
      "id": "artifact-02",
      "media_type": "application/json",
      "repository_path": "paper/overleaf_jnm/figures/final/fig04c_trace_taxonomy_lobo_summary.json",
      "role": "summary",
      "sha256": "de62ddf66ee1650430c59dee6c33668f85689b033f1c6fcf8e2c4343bbabfbbf"
    }
  ],
  "boundaries": {
    "does_not_establish": [
      "Claims beyond the registered finding and linked claim scopes.",
      "Reproducible run provenance that was absent from the v1 story."
    ],
    "limitations": [
      "One recording; classes are descriptive measurement phenotypes."
    ],
    "scope": "This capsule preserves the registered v1 experiment finding and its linked claim scopes."
  },
  "claim_impacts": [
    {
      "claim_id": "NREV-CLM-0002",
      "effect": "supports",
      "scope": "T1 has 38 sites and T2 has 12 sites; these are not biological neuron types.",
      "summary": "The experiment supports this claim only within its registered scope."
    }
  ],
  "evidence_tier": "current_recording",
  "experiment_id": "NREV-EXP-0002",
  "gates": [
    {
      "criterion": "Every artifact referenced by the v1 experiment story is available and checksum identified at migration.",
      "id": "legacy-artifact-capture",
      "observed": "Captured 2 of 2 referenced artifacts with SHA-256 identities.",
      "status": "passed"
    }
  ],
  "generated_at": "2026-08-29T23:52:35Z",
  "id": "NREV-EVC-EXP-0002",
  "legacy_status": "complete_exploratory",
  "lifecycle": "validated",
  "metrics": [],
  "outcome": "inconclusive",
  "program_id": "NREV-PRG-0001",
  "record_type": "evidence_capsule",
  "review_state": "not_requested",
  "run_ids": [],
  "schema_version": 1,
  "source_records_sha256": "cc5591e6e811bf61baf102a250005d701362d7f69b839b01fa08883656f058b0",
  "summary": "T1 contains 38 sites and T2 contains 12, with recurrent but imperfect stage and burst persistence.",
  "validation": {
    "checked_at": "2026-08-29T23:52:35Z",
    "checks": [
      {
        "id": "portable-paths",
        "status": "passed",
        "summary": "Artifact references are repository-relative; ignored local outputs are metadata-only."
      },
      {
        "id": "historical-provenance",
        "status": "not_run",
        "summary": "The v1 story did not encode run-level provenance, so no historical run record was invented."
      }
    ],
    "status": "partial"
  },
  "visibility": "public"
}
